<?xml version="1.0" encoding="utf-8"?>
<!DOCTYPE messages SYSTEM "../messages.dtd">
<messages>
	<message id="highscore_navlabel">Highscore</message>
	<message id="highscore_title">Users Highscore Ranking</message>
	
	<message id="highscore_rank">Rank</message>
	<message id="highscore_user">User</message>
	<message id="highscore_registration_date">Registration Date</message>
	<message id="highscore_score">Score</message>
	
	<message id="user_navlabel">User Profile</message>
	
	<message id="user_tab_profile">Profile</message>
	
	<message id="user_visit_website">visit</message>
	
	<message id="user_changepicture_button">Upload picture</message>
	
	<message id="history_tab">History</message>
	<message id="history_no_records">The user has not completed any season, yet.</message>
</messages>